{
  "contract": "bytedesk.renderer-capability/1",
  "schema": {
    "id": "https://schemas.bytedesk.ai/agent-delivery/v1/renderer-capability/1.0.0",
    "digest": "sha256:353f0d13f2aa207d5689dc54d441a57a5498eaf136cb4668b6ce9cec31e17e73"
  },
  "harnessId": "hermes",
  "rendererId": "hermes",
  "rendererVersion": "1.0.0",
  "rendererContractVersion": "1.0.0",
  "agentSpecVersion": "26.1.2",
  "supportedHarnessVersions": [
    "1.7.0"
  ],
  "supportedPlatforms": [
    "linux/amd64",
    "linux/arm64"
  ],
  "supportedScopes": [
    "public",
    "private"
  ],
  "activationMode": "guarded_in_place",
  "semanticRegistry": {
    "repository": "registry.example/product/contracts",
    "digest": "sha256:abda7be679a48f154763645b3f314d52b646cea1d3a01560594efea0f8782733",
    "mediaType": "application/vnd.bytedesk.agent-spec-semantics.v1+json",
    "size": 640,
    "trustPolicy": {
      "id": "product-release-v1",
      "digest": "sha256:a80850c38ad05f095146c0075910ced54b678a2975bb92611a83b810292de757"
    }
  },
  "semanticCount": 3,
  "semantics": [
    {
      "semanticId": "agentspec.delegation",
      "scopes": [
        "public",
        "private"
      ],
      "status": "warning",
      "diagnosticCodes": [
        "renderer_value_normalized"
      ],
      "outputRoles": [
        "hermes-agent"
      ],
      "approvalRequired": false
    },
    {
      "semanticId": "agentspec.instructions",
      "scopes": [
        "public",
        "private"
      ],
      "status": "exact",
      "diagnosticCodes": [],
      "outputRoles": [
        "hermes-agent"
      ],
      "approvalRequired": false
    },
    {
      "semanticId": "agentspec.memory",
      "scopes": [
        "private"
      ],
      "status": "lossy",
      "diagnosticCodes": [
        "renderer_semantic_lossy",
        "renderer_loss_approval_required"
      ],
      "outputRoles": [
        "hermes-agent"
      ],
      "approvalRequired": true
    }
  ],
  "coverageDigest": "sha256:970099fc9b1673c9f2b72001f7fa6607f85309ab0998f693cad2f6f58f232017",
  "schemas": {
    "inputParameters": {
      "id": "https://schemas.bytedesk.ai/agent-delivery/v1/renderer-input-parameters/1.0.0",
      "digest": "sha256:c3bcead71c99b53143f48046ca9ff9c4448717e17f8504692e4a7a5f0754470c"
    },
    "harnessConfiguration": {
      "id": "https://schemas.bytedesk.ai/agent-delivery/v1/harness-configuration/1.0.0",
      "digest": "sha256:d12717fef52ade60c56a3d8389991d2a927948e21d753c66726defb49bbf3b31"
    },
    "compatibilityResult": {
      "id": "https://schemas.bytedesk.ai/agent-delivery/v1/renderer-compatibility-result/1.0.0",
      "digest": "sha256:a2f39d702cd9b149bda5a33439026d15fddf86c18c3a6f9486d4395ceb6af961"
    },
    "renderManifest": {
      "id": "https://schemas.bytedesk.ai/agent-delivery/v1/render-manifest/1.0.0",
      "digest": "sha256:46ad38bfe2d711b45213b6eb520c5fbd9ea306976417c52264a64a76aa037151"
    }
  },
  "publishedAt": "2026-07-17T12:00:00Z",
  "trustPolicy": {
    "id": "product-release-v1",
    "digest": "sha256:a80850c38ad05f095146c0075910ced54b678a2975bb92611a83b810292de757"
  },
  "source": {
    "repository": "https://github.com/ByteDeskAI/bytedesk-agent-delivery",
    "commit": "1170b5e615063535bfc48942baeab15c93ea8aac",
    "treeDigest": "sha256:6f0cc5ddcb7f86b9f5e39e3e2a1beeadf6c77e711348022b13e4336caf199c5f"
  }
}
